source,feed_url,title,link,summary,published,country
The Tech Buzz - Latest Articles,https://www.techbuzz.ai/api/rss/articles,Palantir Veterans Emerge from Stealth with $30M Sequoia Round,https://www.techbuzz.ai/articles/palantir-veterans-emerge-from-stealth-with-30m-sequoia-round,"Two Palantir alums secure Series A from Sequoia, 8VC, and A* for stealth enterprise venture",2026-03-19 06:41:23,USA
Intelligence artificielle : Toute l’actualité sur Le Monde.fr.,https://www.lemonde.fr/intelligence-artificielle/rss_full.xml,« Les emplois du secteur tertiaire sont désormais exposés à la baisse des embauches et à des licenciements »,https://www.lemonde.fr/idees/article/2026/03/19/les-emplois-du-secteur-tertiaire-sont-desormais-exposes-a-la-baisse-des-embauches-et-a-des-licenciements_6672364_3232.html,"Intelligence artificielle, mondialisation et e‑commerce fragilisent massivement l’emploi, dans un mouvement encore sous-estimé, constate, dans une tribune au « Monde », Adrien Charbuy, spécialiste des politiques de l’emploi au sein de l’Etat.",2026-03-19 06:30:01,France
The Tech Buzz - Latest Articles,https://www.techbuzz.ai/api/rss/articles,Google Partners with DocMorris on AI Health Platform for Europe,https://www.techbuzz.ai/articles/google-partners-with-docmorris-on-ai-health-platform-for-europe,Google and DocMorris team up to bring Gemini-powered digital health to Europe,2026-03-19 06:12:34,USA
The Tech Buzz - Latest Articles,https://www.techbuzz.ai/api/rss/articles,Amazon's Alexa+ launches in UK with full generative AI,https://www.techbuzz.ai/articles/amazon-s-alexa-launches-in-uk-with-full-generative-ai,Amazon's AI-powered Alexa+ debuts in Europe with conversational intelligence,2026-03-19 06:12:34,USA
The Tech Buzz - Latest Articles,https://www.techbuzz.ai/api/rss/articles,The Hard-Tech Survival Framework: Building in Stages Instead of Waiting for the Endgame,https://www.techbuzz.ai/articles/the-hard-tech-survival-framework-building-in-stages-instead-of-waiting-for-the-endgame,Why deep-tech companies fail because they assume everything has to work at once.,2026-03-19 04:11:08,USA
Intelligence artificielle : Toute l’actualité sur Le Monde.fr.,https://www.lemonde.fr/intelligence-artificielle/rss_full.xml,"« Le prince Anthropic défie le roi OpenAI, mais il reste prématuré de conclure à un changement de souverain »",https://www.lemonde.fr/idees/article/2026/03/19/le-prince-anthropic-defie-le-roi-openai-mais-il-reste-premature-de-conclure-a-un-changement-de-souverain_6672348_3232.html,"La rivalité entre les deux géants américains de la tech explose au grand jour, entre clashs médiatiques, divergences éthiques sur l’usage militaire de l’IA et bataille commerciale autour de leurs assistants, détaille Alexandre Piquard, journaliste au « Monde », dans sa chronique.",2026-03-19 04:00:23,France
The Tech Buzz - Latest Articles,https://www.techbuzz.ai/api/rss/articles,Samsung Expands Glasses-Free 3D Gaming Library to 120 Titles,https://www.techbuzz.ai/articles/samsung-expands-glasses-free-3d-gaming-library-to-120-titles,"Samsung showcases Odyssey 3D at GDC 2026, partners with studios on HDR10+ GAMING",2026-03-19 01:13:59,USA
The Tech Buzz - Latest Articles,https://www.techbuzz.ai/api/rss/articles,Samsung Holds 17-Year Streak Atop Commercial Display Market,https://www.techbuzz.ai/articles/samsung-holds-17-year-streak-atop-commercial-display-market,"Samsung captures 35.2% market share, ships 2.5M units with AI-powered signage push",2026-03-19 00:41:50,USA
The Tech Buzz - Latest Articles,https://www.techbuzz.ai/api/rss/articles,Meta's Rogue AI Agent Exposes Internal Data to Staff,https://www.techbuzz.ai/articles/meta-s-rogue-ai-agent-exposes-internal-data-to-staff,Security breach as Meta's autonomous AI agent leaks company and user data to unauthorized engineers,2026-03-19 00:18:17,USA
AI News & Artificial Intelligence | TechCrunch,https://techcrunch.com/category/artificial-intelligence/feed/,Meta is having trouble with rogue AI agents,https://techcrunch.com/2026/03/18/meta-is-having-trouble-with-rogue-ai-agents/,A rogue AI agent inadvertently exposed Meta company and user data to engineers who didn't have permission to see it.,2026-03-18 23:42:46,USA
AI News & Artificial Intelligence | TechCrunch,https://techcrunch.com/category/artificial-intelligence/feed/,Sam Altman’s thank-you to coders draws the memes,https://techcrunch.com/2026/03/18/sam-altmans-thank-you-to-coders-draws-the-memes/,Altman expresses gratitude for people who knew how to write their code from scratch. The internet replies with salty jokes.,2026-03-18 23:12:58,USA
The Tech Buzz - Latest Articles,https://www.techbuzz.ai/api/rss/articles,China's ClawdBot Craze: Tech Giants Host Meetups for Mass AI Adoption,https://www.techbuzz.ai/articles/china-s-clawdbot-craze-tech-giants-host-meetups-for-mass-ai-adoption,Baidu and Tencent drive grassroots AI assistant adoption through community events across China,2026-03-18 21:14:28,USA
The Tech Buzz - Latest Articles,https://www.techbuzz.ai/api/rss/articles,Micron Revenue Nearly Triples as AI Memory Demand Explodes,https://www.techbuzz.ai/articles/micron-revenue-nearly-triples-as-ai-memory-demand-explodes,Micron's Q2 earnings crush estimates with revenue up 3x amid AI chip shortage,2026-03-18 20:51:59,USA
The Tech Buzz - Latest Articles,https://www.techbuzz.ai/api/rss/articles,Nothing CEO: AI agents will kill smartphone apps,https://www.techbuzz.ai/articles/nothing-ceo-ai-agents-will-kill-smartphone-apps,Carl Pei predicts AI will replace traditional apps with intent-based systems,2026-03-18 20:51:59,USA
The Tech Buzz - Latest Articles,https://www.techbuzz.ai/api/rss/articles,AI Data Center Boom Sparks Six-Figure Trade Worker Rush,https://www.techbuzz.ai/articles/ai-data-center-boom-sparks-six-figure-trade-worker-rush,"As tech giants race to build AI infrastructure, skilled trades see unprecedented demand",2026-03-18 20:51:59,USA
AI News & Artificial Intelligence | TechCrunch,https://techcrunch.com/category/artificial-intelligence/feed/,Nothing CEO Carl Pei says smartphone apps will disappear as AI agents take their place,https://techcrunch.com/2026/03/18/nothing-ceo-carl-pei-says-smartphone-apps-will-disappear-as-ai-agents-take-their-place/,"Nothing CEO Carl Pei says AI agents will eventually replace apps, shifting smartphones toward systems that understand intent and act on a user's behalf.",2026-03-18 20:30:52,USA
The Tech Buzz - Latest Articles,https://www.techbuzz.ai/api/rss/articles,Nvidia's $11B networking division quietly rivals chip empire,https://www.techbuzz.ai/articles/nvidia-s-11b-networking-division-quietly-rivals-chip-empire,"Nvidia's overlooked networking unit hits $11B quarterly, emerging as massive revenue pillar",2026-03-18 20:13:11,USA
AI News & Artificial Intelligence | TechCrunch,https://techcrunch.com/category/artificial-intelligence/feed/,Nvidia is quietly building a multibillion-dollar behemoth to rival its chips business,https://techcrunch.com/2026/03/18/nvidia-networking-division-building-a-multibillion-dollar-behemoth-to-rival-its-chips-business/,Nvidia's networking business raked in $11 billion last quarter despite getting significantly less fanfare than chips and gaming.,2026-03-18 20:01:19,USA
The Tech Buzz - Latest Articles,https://www.techbuzz.ai/api/rss/articles,FBI Confirms It Buys Location Data to Track Americans Sans Warrant,https://www.techbuzz.ai/articles/fbi-confirms-it-buys-location-data-to-track-americans-sans-warrant,"Director Kash Patel admits agency purchases commercial location data, bypassing warrants",2026-03-18 19:40:33,USA
The Tech Buzz - Latest Articles,https://www.techbuzz.ai/api/rss/articles,Robinhood launches social trading network in beta,https://www.techbuzz.ai/articles/robinhood-launches-social-trading-network-in-beta,Trading app beta tests Twitter-like social feed for trades and market chatter,2026-03-18 19:12:49,USA
The Tech Buzz - Latest Articles,https://www.techbuzz.ai/api/rss/articles,Viral ChatGPT Dog Cancer Cure Story Falls Apart Under Scrutiny,https://www.techbuzz.ai/articles/viral-chatgpt-dog-cancer-cure-story-falls-apart-under-scrutiny,Tech entrepreneur's claim that AI cured his dog exposes dangerous gap between hype and reality,2026-03-18 18:51:16,USA
The Tech Buzz - Latest Articles,https://www.techbuzz.ai/api/rss/articles,"Walmart Dumps OpenAI Checkout, Plugs Sparky Into ChatGPT",https://www.techbuzz.ai/articles/walmart-dumps-openai-checkout-plugs-sparky-into-chatgpt,Walmart pivots from failed OpenAI Instant Checkout to embed Sparky across ChatGPT and Gemini,2026-03-18 18:51:16,USA
AI | The Verge,https://www.theverge.com/rss/ai-artificial-intelligence/index.xml,David Sacks’ big Iran warning gets big time ignored,https://www.theverge.com/column/896949/regulator-david-sacks-iran-polymarket,"Hello and welcome to Regulator, a newsletter for Verge subscribers about the politics of technology and the technology of politics - now landing in your inbox on Wednesdays! If someone has forwarded this email to you, and you're not a Verge subscriber yet, you should sign up right here, and not just because it would [&#8230;]",2026-03-18 18:44:21,USA
The Tech Buzz - Latest Articles,https://www.techbuzz.ai/api/rss/articles,Pardoned Nikola Founder Seeks $1B for AI Autonomous Jets,https://www.techbuzz.ai/articles/pardoned-nikola-founder-seeks-1b-for-ai-autonomous-jets,Trevor Milton returns post-pardon to raise funding for AI-powered planes via SyberJet,2026-03-18 18:19:45,USA
The Tech Buzz - Latest Articles,https://www.techbuzz.ai/api/rss/articles,Google Labs Unveils Stitch: AI-Native UI Design Platform,https://www.techbuzz.ai/articles/google-labs-unveils-stitch-ai-native-ui-design-platform,"Google's experimental division launches Stitch, democratizing UI design with AI collaboration",2026-03-18 18:19:45,USA
The Tech Buzz - Latest Articles,https://www.techbuzz.ai/api/rss/articles,Patreon CEO Slams AI Fair Use Defense as 'Bogus' Argument,https://www.techbuzz.ai/articles/patreon-ceo-slams-ai-fair-use-defense-as-bogus-argument,"Jack Conte challenges AI companies at SXSW, arguing licensing deals expose hypocrisy",2026-03-18 18:19:45,USA
AI | The Verge,https://www.theverge.com/rss/ai-artificial-intelligence/index.xml,ChatGPT did not cure a dog’s cancer,https://www.theverge.com/ai-artificial-intelligence/896878/ai-did-not-cure-this-dogs-cancer,"When an Australian tech entrepreneur with no background in biology or medicine said ChatGPT helped save his dog from cancer, the story spread with the kind of validation Big Tech has long craved: proof that AI will revolutionize medicine and take on one of its deadliest diseases. The reality, as usual, is more complicated. The [&#8230;]",2026-03-18 18:14:39,USA
AI News & Artificial Intelligence | TechCrunch,https://techcrunch.com/category/artificial-intelligence/feed/,"Patreon CEO calls AI companies’ fair use argument ‘bogus,’ says creators should be paid",https://techcrunch.com/2026/03/18/patreon-ceo-calls-ai-companies-fair-use-argument-bogus-says-creators-should-be-paid/,"Patreon CEO Jack Conte says AI companies should pay creators for training data, arguing their fair use defense falls apart when they license content from major publishers.",2026-03-18 17:54:31,USA
AI News & Artificial Intelligence | TechCrunch,https://techcrunch.com/category/artificial-intelligence/feed/,Rebel Audio is a new AI podcasting tool aimed at first-time creators,https://techcrunch.com/2026/03/18/rebel-audio-is-a-new-ai-podcasting-tool-aimed-at-first-time-creators/,"Rebel Audio is a new all-in-one podcasting tool that allows creators to record podcasts, edit, clip content for social, and publish episodes, all without ever leaving the platform.",2026-03-18 17:15:00,USA
The Tech Buzz - Latest Articles,https://www.techbuzz.ai/api/rss/articles,Arena's LLM Leaderboard Raises Eyebrows: Funded by Those It Ranks,https://www.techbuzz.ai/articles/arena-s-llm-leaderboard-raises-eyebrows-funded-by-those-it-ranks,AI benchmark Arena went from UC Berkeley research to industry kingmaker in 7 months,2026-03-18 16:44:12,USA
AI News & Artificial Intelligence | TechCrunch,https://techcrunch.com/category/artificial-intelligence/feed/,The Gemini-powered features in Google Workspace that are worth using,https://techcrunch.com/2026/03/18/the-gemini-powered-features-in-google-workspace-that-are-worth-using/,"From summarizing emails, drafting content, organizing data, and tracking meetings, here are all the best Gemini features in Google Workspace.",2026-03-18 16:43:18,USA
AI News & Artificial Intelligence | TechCrunch,https://techcrunch.com/category/artificial-intelligence/feed/,"The leaderboard “you can’t game,” funded by the companies it ranks",https://techcrunch.com/video/the-leaderboard-you-cant-game-funded-by-the-companies-it-ranks/,"Artificial intelligence&#160;models are multiplying fast, and competition is stiff. With so many players crowding the space, which one will be the best&#160;— and who decides that?&#160;Arena, formerly LM Arena, has&#160;emerged&#160;as the de facto public leaderboard for frontier LLMs, influencing funding, launches, and PR cycles. In just seven months, the startup went from a&#160;UC&#160;Berkeley PhD research [&#8230;]",2026-03-18 16:30:00,USA
The Tech Buzz - Latest Articles,https://www.techbuzz.ai/api/rss/articles,Eragon Raises $12M to Turn Enterprise Software Into Prompts,https://www.techbuzz.ai/articles/eragon-raises-12m-to-turn-enterprise-software-into-prompts,Startup secures seed funding to build AI OS that replaces complex interfaces,2026-03-18 16:25:45,USA
The Tech Buzz - Latest Articles,https://www.techbuzz.ai/api/rss/articles,Meta Launches Creator Fast Track With $3B Annual Payouts,https://www.techbuzz.ai/articles/meta-launches-creator-fast-track-with-3b-annual-payouts,Facebook's new program guarantees up to $3K monthly for creators while 2025 payouts hit record $3B,2026-03-18 16:25:45,USA
The Tech Buzz - Latest Articles,https://www.techbuzz.ai/api/rss/articles,Microsoft Acqui-Hires Sequoia-Backed Cove in AI Talent Grab,https://www.techbuzz.ai/articles/microsoft-acqui-hires-sequoia-backed-cove-in-ai-talent-grab,Sequoia-backed AI collaboration startup Cove shuts down as team joins Microsoft,2026-03-18 16:25:45,USA
The Tech Buzz - Latest Articles,https://www.techbuzz.ai/api/rss/articles,Sequen raises $16M to democratize TikTok's AI personalization,https://www.techbuzz.ai/articles/sequen-raises-16m-to-democratize-tiktok-s-ai-personalization,Series A brings enterprise-grade recommendation tech to consumer brands,2026-03-18 16:25:44,USA
The Tech Buzz - Latest Articles,https://www.techbuzz.ai/api/rss/articles,"Meta Paid Creators $3B in 2025, Launches New Program",https://www.techbuzz.ai/articles/meta-paid-creators-3b-in-2025-launches-new-program,Facebook rolls out monetization program targeting TikTok and YouTube creators,2026-03-18 16:25:44,USA
AI News & Artificial Intelligence | TechCrunch,https://techcrunch.com/category/artificial-intelligence/feed/,This startup wants to make enterprise software look more like a prompt,https://techcrunch.com/2026/03/18/this-startup-wants-to-make-enterprise-software-look-more-like-a-prompt/,The company has raised $12 million in seed funding to build an AI operating system for enterprise.,2026-03-18 16:00:00,USA
AI News & Artificial Intelligence | TechCrunch,https://techcrunch.com/category/artificial-intelligence/feed/,Sequen snags $16M to bring TikTok-style personalization tech to any consumer company,https://techcrunch.com/2026/03/18/sequen-snags-16m-to-bring-tiktok-style-personalization-tech-to-any-consumer-company/,"With its Series A, Sequen is bringing its proprietary AI ranking and personalization technology to large consumer business.",2026-03-18 15:58:50,USA
The Tech Buzz - Latest Articles,https://www.techbuzz.ai/api/rss/articles,Meta Kills Horizon Worlds VR Platform in Major Metaverse Retreat,https://www.techbuzz.ai/articles/meta-kills-horizon-worlds-vr-platform-in-major-metaverse-retreat,"Meta shutters flagship VR social platform, cuts Reality Labs staff to double down on AI",2026-03-18 15:42:54,USA
AI News & Artificial Intelligence | TechCrunch,https://techcrunch.com/category/artificial-intelligence/feed/,"Microsoft hires the team of Sequoia-backed AI collaboration platform, Cove",https://techcrunch.com/2026/03/18/microsoft-hires-the-team-of-sequioa-backed-ai-collaboration-platform-cove/,"AI collaboration startup Cove is shutting down after its team joined Microsoft, with service ending April 1 and customer data set for deletion.",2026-03-18 15:33:49,USA
The Tech Buzz - Latest Articles,https://www.techbuzz.ai/api/rss/articles,Marquis Ransomware Attack Exposes 672K Social Security Numbers,https://www.techbuzz.ai/articles/marquis-ransomware-attack-exposes-672k-social-security-numbers,"Fintech firm Marquis disclosed a massive ransomware breach affecting over 672,000 users",2026-03-18 15:19:17,USA
The Tech Buzz - Latest Articles,https://www.techbuzz.ai/api/rss/articles,Internet Legend Paul Vixie Joins AWS to Battle AI Threats,https://www.techbuzz.ai/articles/internet-legend-paul-vixie-joins-aws-to-battle-ai-threats,DNS pioneer who fought spam now leads AWS security strategy for agentic AI era,2026-03-18 15:19:16,USA
Intelligence artificielle : Toute l’actualité sur Le Monde.fr.,https://www.lemonde.fr/intelligence-artificielle/rss_full.xml,Les accords d’entreprise abordant la question de l’IA se multiplient,https://www.lemonde.fr/economie/article/2026/03/18/les-accords-d-entreprise-abordant-la-question-de-l-ia-se-multiplient_6672098_3234.html,"Le nombre d’accords mentionnant l’intelligence artificielle a quasiment doublé entre 2024 et 2025, dans les secteurs de la finance, de l’industrie et de l’information et de la communication. Et la place de l’emploi dans ces textes ne cesse d’augmenter.",2026-03-18 15:00:11,France
AI News & Artificial Intelligence | TechCrunch,https://techcrunch.com/category/artificial-intelligence/feed/,The PhD students who became the judges of the AI industry,https://techcrunch.com/podcast/the-phd-students-who-became-the-judges-of-the-ai-industry/,"Artificial intelligence&#160;models are multiplying fast, and competition is stiff. With so many players crowding the space, which one will be the best&#160;— and who decides that?&#160;Arena, formerly LM Arena, has&#160;emerged&#160;as the de facto public leaderboard for frontier LLMs, influencing funding, launches, and PR cycles. In just seven months, the startup went from a&#160;UC&#160;Berkeley PhD research [&#8230;]",2026-03-18 15:00:00,USA
The Tech Buzz - Latest Articles,https://www.techbuzz.ai/api/rss/articles,DarkSword iPhone Exploit Targets iOS 18 in Active Attacks,https://www.techbuzz.ai/articles/darksword-iphone-exploit-targets-ios-18-in-active-attacks,Russian hackers deploy zero-click iPhone exploit affecting hundreds of millions of devices,2026-03-18 14:47:03,USA
The Tech Buzz - Latest Articles,https://www.techbuzz.ai/api/rss/articles,Nvidia's DLSS 5 Face AI Sparks Gaming Revolt,https://www.techbuzz.ai/articles/nvidia-s-dlss-5-face-ai-sparks-gaming-revolt,CEO Jensen Huang says gamers are 'completely wrong' about DLSS 5 backlash,2026-03-18 13:58:43,USA
AI News & Artificial Intelligence | TechCrunch,https://techcrunch.com/category/artificial-intelligence/feed/,DOD says Anthropic’s ‘red lines’ make it an ‘unacceptable risk to national security’,https://techcrunch.com/2026/03/18/dod-says-anthropics-red-lines-make-it-an-unacceptable-risk-to-national-security/,"The Defense Department said concerns that Anthropic might ""attempt to disable its technology"" during ""warfighting operations"" validate its decision to label the AI firm a supply-chain risk.",2026-03-18 13:40:43,USA
Intelligence artificielle : Toute l’actualité sur Le Monde.fr.,https://www.lemonde.fr/intelligence-artificielle/rss_full.xml,L’ombre de l’IA sur l’avenir des emplois : « Cela va tellement vite qu’on ne sait pas ce qu’on sera dans cinq ans »,https://www.lemonde.fr/economie/article/2026/03/18/l-ombre-de-l-ia-sur-l-avenir-des-emplois-cela-va-tellement-vite-qu-on-ne-sait-pas-ce-qu-on-sera-dans-cinq-ans_6672086_3234.html,"De l’outil d’assistance développé en interne aux prévisions d’emplois « à risques », les entreprises françaises tentent d’anticiper les bouleversements que va engendrer l’arrivée de l’intelligence artificielle dans leur organisation.",2026-03-18 13:00:13,France
AI | The Verge,https://www.theverge.com/rss/ai-artificial-intelligence/index.xml,DLSS 5: Has Nvidia&#8217;s AI graphics technology gone too far?,https://www.theverge.com/games/896518/nvidia-dlss-5-ai-3d-rendering,"Nvidia has revealed a new “3D guided neural rendering model” called DLSS 5 that can change a game’s lighting and materials in real-time, and… many gamers aren’t happy. From DLSS 5 memes to complaints about how it’s “yassified” Resident Evil Requiem characters in demos, the first impression has not been a good one, no matter [&#8230;]",2026-03-18 12:30:00,USA
ZDNet actualites,https://www.zdnet.fr/feeds/rss/actualites/,Mistral Forge : l’offensive de Mistral AI pour rendre l’IA d’entreprise réellement souveraine,https://www.zdnet.fr/actualites/mistral-forge-loffensive-de-mistral-ai-pour-rendre-lia-dentreprise-reellement-souveraine-492045.htm#xtor=RSS-1,"Avec le lancement de Forge, Mistral AI s'attaque au dernier verrou de l'adoption de l'IA en entreprise : la dépendance aux modèles généralistes. En permettant aux organisations d'entraîner des modèles sur leurs propres standards, codes et politiques, la pépite française promet une IA contrôlable.",2026-03-18 11:03:12,France
Intelligence artificielle : Toute l’actualité sur Le Monde.fr.,https://www.lemonde.fr/intelligence-artificielle/rss_full.xml,"L’IA est une menace pour 5 millions de salariés en France, selon une étude",https://www.lemonde.fr/economie/article/2026/03/18/l-ia-une-menace-pour-5-millions-de-salaries-en-france_6672064_3234.html,"La généralisation de l’intelligence artificielle dans les entreprises menace particulièrement les métiers les plus rémunérés, selon une étude de la Coface et de l’Observatoire des emplois menacés et émergents.",2026-03-18 10:00:20,France
ZDNet actualites,https://www.zdnet.fr/feeds/rss/actualites/,Test Garmin InReach Mini 3 Plus : ce petit appareil satellitaire peut remplacer votre montre de sport dans vos aventures les plus lointaines,https://www.zdnet.fr/guide-achat/492002-492002.htm#xtor=RSS-1,"L’accessoire en forme de mini talkie-walkie s'avère exceptionnel pour la messagerie, le suivi de localisation et bien plus encore à extérieur, dans des zones hors réseau.",2026-03-18 07:03:51,France
ZDNet actualites,https://www.zdnet.fr/feeds/rss/actualites/,Pixel pratique : comment activer les résumés de notifications,https://www.zdnet.fr/pratique/492021-492021.htm#xtor=RSS-1,"A certaines conditions, le smartphone de Google peut désormais afficher ces récapitulatifs générés par l’IA sur l’écran de verrouillage. Mais il existe quelques mises en garde, notamment un problème potentiel de confidentialité.",2026-03-18 07:03:26,France
ZDNet actualites,https://www.zdnet.fr/feeds/rss/actualites/,Comment les agents IA challengent notre vision du CRM ?,https://www.zdnet.fr/blogs/green-si/comment-les-agents-ia-challengent-notre-vision-du-crm-492054.htm#xtor=RSS-1,Le commercial de demain ne prospecte plus. Les agents IA sont sur toute la chaîne de relation clients. Le CRM a clairement peu de chance de survivre en l'état. L'IA accélère l'obsolescence de nos SI !,2026-03-18 07:03:16,France
ZDNet actualites,https://www.zdnet.fr/feeds/rss/actualites/,"Dacia, Citroën, Tesla, pourquoi ces constructeurs retirent l’autoradio de leurs voitures et ce qui pourrait changer",https://www.zdnet.fr/actualites/dacia-citroen-tesla-pourquoi-ces-constructeurs-retirent-lautoradio-de-leurs-voitures-et-ce-qui-pourrait-changer-492088.htm#xtor=RSS-1,"Fini l'autoradio de série ? Pour faire baisser les prix, des constructeurs livrent désormais certains modèles sans aucun système radio, misant tout sur votre smartphone. Une tendance ""low-cost"" qui fait bondir l'Arcom.",2026-03-18 07:03:07,France
ZDNet actualites,https://www.zdnet.fr/feeds/rss/actualites/,Gilles Babinet et la « stratégie de marchand d’héroïne »,https://www.zdnet.fr/actualites/gilles-babinet-et-la-strategie-de-marchand-dheroine-492066.htm#xtor=RSS-1,Gilles Babinet dresse un réquisitoire contre la dépendance structurelle aux infrastructures américaines. Seule une planification industrielle sur le temps long permettra de sauvegarder la viabilité du projet démocratique européen.,2026-03-18 05:03:24,France
ZDNet actualites,https://www.zdnet.fr/feeds/rss/actualites/,Alerte Glassworm : l'attaque par Unicode invisible fragmente la supply chain sur GitHub et npm,https://www.zdnet.fr/actualites/alerte-glassworm-lattaque-par-unicode-invisible-fragmente-la-supply-chain-sur-github-et-npm-492071.htm#xtor=RSS-1,"La menace Glassworm refait surface avec une intensité inédite. En exploitant des caractères Unicode invisibles pour dissimuler des charges utiles malveillantes, cette campagne compromet des centaines de dépôts et interroge la fiabilité des outils de revue de code face à l'obfuscation.",2026-03-18 04:03:40,France
