source,feed_url,title,link,summary,published,country
AI | The Verge,https://www.theverge.com/rss/ai-artificial-intelligence/index.xml,The future of code is exciting and terrifying,https://www.theverge.com/podcast/895910/claude-code-future-developers-vergecast,"Suddenly it seems like everyone's a coder. Or, at the very least, like they play one in the Claude Code app. But even for the seasoned pros, the act of software development is changing fast - many people are writing less code themselves and instead spending their time managing agents and projects. So what does [&#8230;]",2026-03-17 15:16:47,USA
Intelligence artificielle : Toute l’actualité sur Le Monde.fr.,https://www.lemonde.fr/intelligence-artificielle/rss_full.xml,"« Les Européens ont une version dégradée de l’IA, ce qui ne peut que retarder leur adaptation »",https://www.lemonde.fr/idees/article/2026/03/17/les-europeens-ont-une-version-degradee-de-l-ia-ce-qui-ne-peut-que-retarder-leur-adaptation_6671709_3232.html,"Face à la lame de fond économique de l’intelligence artificielle, Arnaud Leparmentier, dans sa chronique, invite l’Europe à être plus réactive et à ne pas s’enfermer dans la seule incantation de la souveraineté numérique.",2026-03-17 12:00:06,France
ZDNet actualites,https://www.zdnet.fr/feeds/rss/actualites/,"Apple lance l'AirPods Max 2 à 579 €, voici les nouveautés du casque haut de gamme d'Apple",https://www.zdnet.fr/actualites/apple-lance-lairpods-max-2-a-579-e-voici-les-nouveautes-du-casque-haut-de-gamme-dapple-491973.htm#xtor=RSS-1,"L'AirPods Max 2 d'Apple est doté d'une nouvelle puce H2, d'une réduction active du bruit (ANC) améliorée et d'un meilleur son par rapport à son prédécesseur.",2026-03-17 11:03:01,France
ZDNet actualites,https://www.zdnet.fr/feeds/rss/actualites/,"ZDNET Morning 17/03/2026 : Projet Nvidia / Uber, Meta sacrifie 20 % de ses effectifs, Comment je suis passée de 13h à 1h d'écran par jour,...",https://www.zdnet.fr/actualites/zdnet-morning-17-03-2026-projet-nvidia-uber-meta-sacrifie-20-de-ses-effectifs-comment-je-suis-passee-de-13h-a-1h-decran-par-jour-491965.htm#xtor=RSS-1,"Le ZDNET Morning le brief de l'actu tech pour les pros tous les matins à 9h00. Transformation numérique, IA, matériel, logiciels,... ne passez pas à côté de ce qui fait la Une du secteur.",2026-03-17 10:03:49,France
ZDNet actualites,https://www.zdnet.fr/feeds/rss/actualites/,Nvidia et Uber annoncent l'arrivée de flottes de véhicules autonomes dans 28 villes dès 2027,https://www.zdnet.fr/actualites/nvidia-evoque-une-avancee-majeure-pour-les-voitures-autonomes-et-fait-dautres-annonces-cles-en-matiere-dia-491954.htm#xtor=RSS-1,"Voici les progrès concrets en IA que Nvidia affirme réaliser dans les domaines de la robotique, des véhicules autonomes et plus encore.",2026-03-17 09:03:56,France
ZDNet actualites,https://www.zdnet.fr/feeds/rss/actualites/,Guerre en Ukraine : des robots de combat testés sur le champ de bataille,https://www.zdnet.fr/actualites/guerre-en-ukraine-des-robots-de-combat-testes-sur-le-champ-de-bataille-491946.htm#xtor=RSS-1,Une start-up américaine affirme avoir déployé deux robots humanoïdes Phantom MK-1 sur le front ukrainien afin d’évaluer leurs capacités en conditions réelles de combat. Une expérimentation qui illustre l’accélération du développement des technologies militaires autonomes.,2026-03-17 09:03:24,France
ZDNet actualites,https://www.zdnet.fr/feeds/rss/actualites/,"Test Motorola Moto Watch : agréable et simple d’usage, elle laissera sur leur faim les utilisateurs les plus expérimentés",https://www.zdnet.fr/guide-achat/test-motorola-moto-watch-agreable-et-simple-dusage-elle-laissera-sur-leur-faim-les-utilisateurs-les-plus-experimentes-491957.htm#xtor=RSS-1,"Développée avec le spécialiste du suivi d’activités sportives Polar, cette montre est minimaliste, possède un bel écran OLED et dispose d’une très bonne autonomie.",2026-03-17 08:03:54,France
ZDNet actualites,https://www.zdnet.fr/feeds/rss/actualites/,"ZD Tech : vols de voitures, les méthodes tech explosent",https://www.zdnet.fr/actualites/zd-tech-vols-de-voitures-les-methodes-tech-explosent-491678.htm#xtor=RSS-1,"Une nouvelle forme de délinquance électronique, le ""mouse jacking"", rend les effractions physiques presque invisibles : désormais, 70 % des véhicules sont dérobés sans aucun bris de glace ni serrure forcée.",2026-03-17 08:03:43,France
ZDNet actualites,https://www.zdnet.fr/feeds/rss/actualites/,Les administrateurs d’YggTorrent jettent finalement l’éponge,https://www.zdnet.fr/actualites/les-administrateurs-dyggtorrent-jettent-finalement-leponge-491991.htm#xtor=RSS-1,"Le célèbre site de partage de liens de téléchargement voulait se relancer après son piratage. Au vu des difficultés, ses administrateurs ont fini par baisser définitivement le rideau.",2026-03-17 07:03:55,France
ZDNet actualites,https://www.zdnet.fr/feeds/rss/actualites/,Nemotron coalition : Nvidia embarque les acteurs français,https://www.zdnet.fr/actualites/nemotron-coalition-nvidia-embarque-les-acteurs-francais-491998.htm#xtor=RSS-1,"Nvidia souhaite fédérer les acteurs des technologies d'intelligence artificielle open source au sein de sa Nemotron Coalition. Parmi les premiers acteurs à la manœuvre, on retrouve les français de Mistral AI.",2026-03-17 07:03:53,France
ZDNet actualites,https://www.zdnet.fr/feeds/rss/actualites/,Pixel pratique : comment activer le VPN gratuit de Google sur votre smartphone,https://www.zdnet.fr/pratique/pixel-pratique-comment-activer-le-vpn-gratuit-de-google-sur-votre-smartphone-491938.htm#xtor=RSS-1,Ces mobiles-là intègrent cet outil de confidentialité dans leurs paramètres. Voici comment le trouver et pourquoi vous devriez l'utiliser.,2026-03-17 07:03:52,France
ZDNet actualites,https://www.zdnet.fr/feeds/rss/actualites/,Kafka au cœur de watsonx : ce que le rachat de Confluent change pour l'intégration de données,https://www.zdnet.fr/actualites/kafka-au-coeur-de-watsonx-ce-que-le-rachat-de-confluent-change-pour-lintegration-de-donnees-492007.htm#xtor=RSS-1,"IBM vient de finaliser l'acquisition de Confluent pour 11 milliards de dollars. En intégrant la plateforme de streaming de données leader du marché à son écosystème watsonx et ses mainframes, IBM entend lever le principal verrou de l'IA en entreprise : l'accès à une donnée fraîche, gouvernée et actionnable en temps réel.",2026-03-17 07:03:28,France
ZDNet actualites,https://www.zdnet.fr/feeds/rss/actualites/,"Avec NemoClaw, Nvidia mise sur OpenClaw en y ajoutant une couche de sécurité",https://www.zdnet.fr/actualites/avec-nemoclaw-nvidia-mise-sur-openclaw-en-y-ajoutant-une-couche-de-securite-491943.htm#xtor=RSS-1,"L’entreprise considère OpenClaw comme l’avenir de l’IA personnelle, mais lui apporte un soutien indispensable en matière de confidentialité et de sécurité.",2026-03-17 07:03:20,France
ZDNet actualites,https://www.zdnet.fr/feeds/rss/actualites/,Cyberattaques : pourquoi l'UE gèle les actifs de 3 acteurs de l'offensive cyber,https://www.zdnet.fr/actualites/cyberattaques-pourquoi-lue-gele-les-actifs-de-3-acteurs-de-loffensive-cyber-492013.htm#xtor=RSS-1,"Face à la multiplication des opérations de déstabilisation et d’espionnage industriel, le Conseil de l’UE sanctionne des entités basées en Chine et en Iran. Ces mesures marquent une étape clé dans l’attribution des cyberattaques.",2026-03-17 07:03:08,France
ZDNet actualites,https://www.zdnet.fr/feeds/rss/actualites/,OpenAI : le virage vers le B2B pour contrer l'ascension d'Anthropic,https://www.zdnet.fr/actualites/openai-le-virage-vers-le-b2b-pour-contrer-lascension-danthropic-492001.htm#xtor=RSS-1,"Face à une dispersion des ressources et à la concurrence féroce d'Anthropic sur le segment des développeurs, OpenAI engage une restructuration profonde.",2026-03-17 06:03:54,France
ZDNet actualites,https://www.zdnet.fr/feeds/rss/actualites/,Comment Nvidia veut posséder votre centre de données d'IA de bout en bout,https://www.zdnet.fr/actualites/comment-nvidia-veut-posseder-votre-centre-de-donnees-dia-de-bout-en-bout-491996.htm#xtor=RSS-1,"Le PDG de Nvidia soutient que les centres de données d'IA seront plus efficaces, plus économiques et généreront plus de revenus si vous achetez tous les composants auprès de son entreprise. Malin !",2026-03-17 05:03:44,France
ZDNet actualites,https://www.zdnet.fr/feeds/rss/actualites/,"Orange dope sa relation client à l’IA, la CFE-CGC inquiète pour les conditions de travail",https://www.zdnet.fr/actualites/orange-dope-sa-relation-client-a-lia-la-cfe-cgc-inquiete-pour-les-conditions-de-travail-491976.htm#xtor=RSS-1,L’opérateur déploie deux nouveaux services d’IA pour assister ses conseillers ou automatiser les échanges vocaux avec les clients. Le syndicat CFE-CGC redoute une surveillance généralisée des employés.,2026-03-17 01:03:32,France
ZDNet actualites,https://www.zdnet.fr/feeds/rss/actualites/,E-commerce : JD.com lance Joybuy en France pour briser le monopole d'Amazon,https://www.zdnet.fr/actualites/e-commerce-jd-com-lance-joybuy-en-france-pour-briser-le-monopole-damazon-491983.htm#xtor=RSS-1,"Le géant chinois déploie sa plateforme Joybuy en France et en Europe, misant sur une logistique éclair et une politique ""zéro contrefaçon"". Entre rachat de Ceconomy et livraison en moins de 12 heures, le paysage du retail vit une mutation profonde.",2026-03-17 01:03:24,France
AI | The Verge,https://www.theverge.com/rss/ai-artificial-intelligence/index.xml,DLSS 5 looks like a real-time generative AI filter for video games,https://www.theverge.com/news/895472/nvidia-dlss5-generative-ai-pc-graphics,"Nvidia announced DLSS 5 on Monday during its GTC conference, and based on early reactions, it's going to be a divisive update, with some reactions calling it ""slop"" that unacceptably alters artistic intent. Nvidia CEO Jensen Huang is calling this the ""GPT moment for graphics - blending hand-crafted rendering with generative AI to deliver a [&#8230;]",2026-03-16 21:56:05,USA
AI | The Verge,https://www.theverge.com/rss/ai-artificial-intelligence/index.xml,Teens sue Elon Musk’s xAI over Grok’s AI-generated CSAM,https://www.theverge.com/ai-artificial-intelligence/895639/xai-grok-teens-lawsuit-grok-ai-elon-musk,"Three Tennessee teens are suing Elon Musk's xAI over claims that the company's Grok AI chatbot generated sexualized images and videos of themselves as minors, as reported earlier by The Washington Post. The proposed class action lawsuit, filed on Monday, accuses Musk and other xAI leaders of knowing that Grok would produce AI-generated child sexual [&#8230;]",2026-03-16 21:44:11,USA
AI | The Verge,https://www.theverge.com/rss/ai-artificial-intelligence/index.xml,Benjamin Netanyahu is struggling to prove he&#8217;s not an AI clone,https://www.theverge.com/tech/895453/ai-deepfake-netanyahu-claims-conspiracy,"Social media platforms are currently awash with conspiracy theories claiming that Benjamin Netanyahu has been killed or injured and replaced by AI-generated deepfakes. Between clips that supposedly show the Israeli prime minister sporting extra fingers and drinking from a bottomless, gravity-defying cup of coffee, only one thing is apparent: Reality used to be much easier [&#8230;]",2026-03-16 20:41:55,USA
AI | The Verge,https://www.theverge.com/rss/ai-artificial-intelligence/index.xml,Encyclopedia Britannica is suing OpenAI for allegedly ‘memorizing’ its content with ChatGPT,https://www.theverge.com/ai-artificial-intelligence/895372/encyclopedia-britannica-openai-lawsuit,"On Friday, Encyclopedia Britannica and dictionary publisher Merriam-Webster filed a lawsuit against OpenAI alleging that it used their copyrighted content to train its AI, then generated responses that were ""substantially similar"" to their content, as previously reported by Reuters. According to Britannica, OpenAI repeatedly copied its content without permission, stating, ""GPT-4 itself has 'memorized' much [&#8230;]",2026-03-16 17:04:06,USA
AI | The Verge,https://www.theverge.com/rss/ai-artificial-intelligence/index.xml,Yahoo CEO Jim Lanzone on reviving the web&#8217;s homepage,https://www.theverge.com/podcast/895221/yahoo-jim-lanzone-scout-ai-sports-finance-open-web,"Today, I’m talking with Jim Lanzone, who is the CEO of Yahoo. It’s basically impossible to sum up the Yahoo story, but the short version of it is that a long time ago Yahoo paid Google to run the search box on its website, and basically everything has gone sideways since. You’ll hear Jim refer [&#8230;]",2026-03-16 15:00:00,USA
Intelligence artificielle : Toute l’actualité sur Le Monde.fr.,https://www.lemonde.fr/intelligence-artificielle/rss_full.xml,"En Chine, la ruée vers OpenClaw, l’agent IA autonome",https://www.lemonde.fr/economie/article/2026/03/16/en-chine-la-ruee-vers-l-agent-ia-autonome-openclaw_6671420_3234.html,"L’outil d’intelligence artificielle, conçu par un programmeur autrichien, connaît un succès fulgurant en Chine. Les géants Baidu, Alibaba et Tencent se livrent une course commerciale pour l’intégrer à leurs services et fidéliser ainsi leurs utilisateurs.",2026-03-16 14:00:00,France
Analytics Vidhya,https://www.analyticsvidhya.com/feed/,Top 7 Free Machine Learning Courses with Certificates,https://www.analyticsvidhya.com/blog/2026/03/free-machine-learning-courses-with-certificates/,"<p>For different learning styles, goals, and comfort levels, finding a course that matches how&#160;you&#160;learn is&#160;HARD. Some people need visuals. While others wanna jump straight into code. Some need structure, others need flexibility. And many learners just want proof of effort at the end in the form of a&#160;certificate. This list is built with that in [&#8230;]</p>
<p>The post <a href=""https://www.analyticsvidhya.com/blog/2026/03/free-machine-learning-courses-with-certificates/"">Top 7 Free Machine Learning Courses with Certificates</a> appeared first on <a href=""https://www.analyticsvidhya.com"">Analytics Vidhya</a>.</p>",2026-03-16 13:00:58,India
Analytics Vidhya,https://www.analyticsvidhya.com/feed/,Harness Engineering with LangChain DeepAgents and LangSmith,https://www.analyticsvidhya.com/blog/2026/03/harness-engineering/,"<p>Struggling to make AI systems reliable and consistent? Many teams face the same problem. A powerful LLM gives great results, but a cheaper model often fails on the same task. This makes production systems hard to scale. Harness engineering offers a solution. Instead of changing the model, you build a system around it. You use [&#8230;]</p>
<p>The post <a href=""https://www.analyticsvidhya.com/blog/2026/03/harness-engineering/"">Harness Engineering with LangChain DeepAgents and LangSmith</a> appeared first on <a href=""https://www.analyticsvidhya.com"">Analytics Vidhya</a>.</p>",2026-03-16 12:50:17,India
AI | The Verge,https://www.theverge.com/rss/ai-artificial-intelligence/index.xml,This is not a fly uploaded to a computer,https://www.theverge.com/ai-artificial-intelligence/894587/fly-brain-computer-upload,"Last week, a few posts about a so-called virtual ""embodied fly"" tore through X, boosted by AI hype accounts and excited commenters who didn't seem to understand what it was they were excited about. The videos came from San Francisco-based Eon Systems, which says it's working toward ""digital human intelligence"" and claims it wants to [&#8230;]",2026-03-16 12:49:07,USA
ZDNet actualites,https://www.zdnet.fr/feeds/rss/actualites/,NanoClaw est désormais disponible dans votre environnement Docker : cela permettra-t-il d'empêcher les agents IA partir en vrille ?,https://www.zdnet.fr/actualites/nanoclaw-est-desormais-disponible-dans-votre-environnement-docker-cela-permettra-t-il-dempecher-les-agents-ia-partir-en-vrille-491901.htm#xtor=RSS-1,Ce nouveau partenariat permet d'intégrer la plateforme open source d'agents IA aux conteneurs Docker. Voici pourquoi c'est une initiative judicieuse.,2026-03-16 12:03:55,France
ZDNet actualites,https://www.zdnet.fr/feeds/rss/actualites/,Pourquoi j'utilise à la fois les gestionnaires de mots de passe d'Apple et de Google – et pourquoi ça ne me dérange pas,https://www.zdnet.fr/actualites/pourquoi-jutilise-a-la-fois-les-gestionnaires-de-mots-de-passe-dapple-et-de-google-et-pourquoi-ca-ne-me-derange-pas-491904.htm#xtor=RSS-1,"Un gestionnaire de mots de passe est idéal pour protéger vos informations, et tout le monde n'a pas besoin d'un modèle sophistiqué : voici pourquoi.",2026-03-16 12:03:47,France
ZDNet actualites,https://www.zdnet.fr/feeds/rss/actualites/,"Le MacBook Neo prouve que Microsoft avait vu juste, mais voici pourquoi sa tactique a totalement foiré",https://www.zdnet.fr/actualites/le-macbook-neo-prouve-que-microsoft-avait-vu-juste-mais-que-sa-mise-a-totalement-foire-491898.htm#xtor=RSS-1,Le succès de l'ordinateur portable économique d'Apple est en grande partie lié à l'échec de la Surface RT de Microsoft. Voici en quoi ils sont liés.,2026-03-16 12:03:32,France
ZDNet actualites,https://www.zdnet.fr/feeds/rss/actualites/,Kerberoasting en 2026 : comment protéger vos comptes de service,https://www.zdnet.fr/publicite/kerberoasting-en-2026-comment-proteger-vos-comptes-de-service-491511.htm#xtor=RSS-1,"Le Kerberoasting demeure un défi majeur pour les équipes IT, offrant aux hackers la possibilité de pénétrer les niveaux les plus sensibles de votre Active Directory. Mais en combinant mots de passe solides, chiffrement performant et politiques de cybersécurité rigoureuses, vous pouvez neutraliser les attaques avant qu’elles ne démarrent.",2026-03-16 10:03:42,France
ZDNet actualites,https://www.zdnet.fr/feeds/rss/actualites/,"ZDNET Morning 16/03/2026 : Test MacBook Neo, L'État français lorgne sur Linux, Android 16 et protection avancée,...",https://www.zdnet.fr/actualites/zdnet-morning-16-03-2026-test-macbook-neo-letat-francais-lorgne-sur-linux-android-16-et-protection-avancee-491896.htm#xtor=RSS-1,"Le ZDNET Morning le brief de l'actu tech pour les pros tous les matins à 9h00. Transformation numérique, IA, matériel, logiciels,... ne passez pas à côté de ce qui fait la Une du secteur.",2026-03-16 10:03:38,France
ZDNet actualites,https://www.zdnet.fr/feeds/rss/actualites/,"GTC 2026 : NVIDIA prépare une salve d’annonces majeures autour de l’IA, des puces d’inférence et des PC portables",https://www.zdnet.fr/actualites/gtc-2026-nvidia-prepare-une-salve-dannonces-majeures-autour-de-lia-des-puces-dinference-et-des-pc-portables-491885.htm#xtor=RSS-1,"Le grand rendez-vous annuel de NVIDIA s’ouvre le 16 mars à San Jose avec le traditionnel keynote de Jensen Huang. Entre nouvelles architectures pour l’IA, intégration de technologies issues de récentes acquisitions et possible entrée sur le marché des processeurs pour PC portables, l’édition 2026 pourrait marquer une nouvelle étape dans la stratégie du géant des semi-conducteurs.",2026-03-16 09:03:42,France
ZDNet actualites,https://www.zdnet.fr/feeds/rss/actualites/,"ZD Tech : ce processeur hybride utilise des neurones vivants pour jouer à Doom, une prouesse qui pourrait révolutionner l'informatique",https://www.zdnet.fr/actualites/zd-tech-ce-processeur-hybride-utilise-des-neurones-vivants-pour-jouer-a-doom-une-prouesse-qui-pourrait-revolutionner-linformatique-491677.htm#xtor=RSS-1,"La start-up australienne Cortical Labs a franchi un cap historique en commercialisant le CL1, un processeur hybride intégrant de véritables neurones humains cultivés en laboratoire.",2026-03-16 08:03:40,France
ZDNet actualites,https://www.zdnet.fr/feeds/rss/actualites/,Le MacBook Neo de deuxième génération sera-t-il équipé d'un écran tactile ?,https://www.zdnet.fr/actualites/le-macbook-neo-de-deuxieme-generation-sera-t-il-equipe-dun-ecran-tactile-491881.htm#xtor=RSS-1,"Alors que le MacBook Neo vient tout juste d’être dévoilé, son successeur fait déjà parler de lui.",2026-03-16 07:03:23,France
ZDNet actualites,https://www.zdnet.fr/feeds/rss/actualites/,Meta : le grand basculement vers l’IA se fera au prix de 20 % de ses effectifs,https://www.zdnet.fr/actualites/meta-le-grand-basculement-vers-lia-se-fera-au-prix-de-20-de-ses-effectifs-491936.htm#xtor=RSS-1,"Face à une course à l’armement technologique sans précédent, Meta Platforms envisage de supprimer un cinquième de ses effectifs mondiaux. Cette restructuration radicale vise à dégager les marges nécessaires pour soutenir un plan d’investissement en IA de 135 milliards de dollars d’ici 2026.",2026-03-16 07:03:22,France
ZDNet actualites,https://www.zdnet.fr/feeds/rss/actualites/,IA dans l’assurance : Axa resigne pour 5 ans avec Shift Technology,https://www.zdnet.fr/actualites/ia-dans-lassurance-axa-resigne-pour-5-ans-avec-shift-technology-491908.htm#xtor=RSS-1,"L’accord groupe entre l’assureur et l’assurtech est prolongé de 5 ans et couvre notamment l’IA appliquée à la gestion des sinistres, la détection de la fraude et la souscription. 15 pays sont concernés.",2026-03-16 06:03:56,France
ZDNet actualites,https://www.zdnet.fr/feeds/rss/actualites/,"Android pratique, comment (et pourquoi) passer en mode sécurisé sur votre smartphone",https://www.zdnet.fr/pratique/android-pratique-comment-passer-en-mode-securise-sur-votre-smartphone-491844.htm#xtor=RSS-1,"Ce mode sans échec vous permet de déterminer si une application défectueuse est à l'origine des plantages, des blocages ou des ralentissements de votre mobile. Voici la procédure.",2026-03-16 06:03:21,France
ZDNet actualites,https://www.zdnet.fr/feeds/rss/actualites/,C'est quoi cette attaque en Pologne si redoutée par l'Anssi ?,https://www.zdnet.fr/actualites/cest-quoi-cette-attaque-en-pologne-si-redoutee-par-lanssi-491913.htm#xtor=RSS-1,Deux wiper et un passage par des instances vulnérables : le Cert polonais a documenté l’attaque informatique qui donne des sueurs froides au cyber-pompier français.,2026-03-16 06:03:15,France
ZDNet actualites,https://www.zdnet.fr/feeds/rss/actualites/,"Retour d’expérience : accro au smartphone, voici comment j’ai réduit drastiquement mon temps d’utilisation",https://www.zdnet.fr/pratique/retour-dexperience-accro-au-smartphone-voici-comment-jai-reduit-drastiquement-mon-temps-dutilisation-491758.htm#xtor=RSS-1,"Je suis passée de 13 heures d'écran, mobile et ordinateur confondus, à environ une heure par jour sur mon téléphone. Je vous propose ma méthode.",2026-03-16 06:03:06,France
ZDNet actualites,https://www.zdnet.fr/feeds/rss/actualites/,Foxconn : l'IA détrône l'iPhone comme moteur de croissance,https://www.zdnet.fr/actualites/foxconn-lia-detrone-liphone-comme-moteur-de-croissance-491922.htm#xtor=RSS-1,"Le géant taïwanais, historiquement lié au destin d'Apple, confirme sa mutation profonde. Avec un bénéfice net annuel en hausse de 24 %, l'entreprise prouve que son virage vers les serveurs IA pour Nvidia et OpenAI compense largement le ralentissement du marché des smartphones.",2026-03-16 05:03:56,France
ZDNet actualites,https://www.zdnet.fr/feeds/rss/actualites/,Oracle 2026 : Le pari colossal de l’infrastructure IA face au mur du cash-flow,https://www.zdnet.fr/actualites/oracle-2026-le-pari-colossal-de-linfrastructure-ia-face-au-mur-du-cash-flow-491920.htm#xtor=RSS-1,"Porté par une demande sans précédent pour l'intelligence artificielle générative, Oracle affiche sa meilleure performance trimestrielle en 15 ans. Mais si les revenus de l'infrastructure cloud s'envolent de 84 %, le groupe doit désormais rentabiliser son carnet de commandes titanesque de 553 milliards de dollars.",2026-03-16 05:03:24,France
ZDNet actualites,https://www.zdnet.fr/feeds/rss/actualites/,Test GL.iNet Mango GL-MT300N-V2 : ce routeur bon marché avec VPN intégré est fort pratique en voyage,https://www.zdnet.fr/guide-achat/test-gl-inet-mango-gl-mt300n-v2-ce-routeur-bon-marche-avec-vpn-integre-est-fort-pratique-en-voyage-491836.htm#xtor=RSS-1,Cet accessoire de petites dimensions permet de contrôler entièrement la façon d'accéder à Internet en déplacement. Très pratique !,2026-03-16 05:03:08,France
ZDNet actualites,https://www.zdnet.fr/feeds/rss/actualites/,Windows 11 : Microsoft bat en retraite sur l'intégration massive de l'IA,https://www.zdnet.fr/actualites/windows-11-microsoft-bat-en-retraite-sur-lintegration-massive-de-lia-491915.htm#xtor=RSS-1,"Sous la pression des utilisateurs et des critiques sur l'encombrement de l'interface, Microsoft est en passe de revoir radicalement sa stratégie pour Windows 11. Le géant de Redmond abandonne plusieurs projets d'intégration native de Copilot au profit d'une approche plus sobre, privilégiant la performance et le contrôle utilisateur sur le ""tout IA"".",2026-03-16 04:03:42,France
ZDNet actualites,https://www.zdnet.fr/feeds/rss/actualites/,Du terrain au cyberespace : la métamorphose du contre-espionnage militaire,https://www.zdnet.fr/actualites/du-terrain-au-cyberespace-la-metamorphose-du-contre-espionnage-militaire-491907.htm#xtor=RSS-1,Le renseignement de contre-ingérence français vit une rupture historique. Le directeur de la DRSD détaille la stratégie pour protéger les forces armées et l'industrie face aux menaces cyber.,2026-03-16 01:03:50,France
