source,feed_url,title,link,summary,published,country
Analytics Vidhya,https://www.analyticsvidhya.com/feed/,Generative AI vs Agentic AI: From Creating Content to Taking Action,https://www.analyticsvidhya.com/blog/2026/03/generative-ai-vs-agentic-ai/,"<p>The last two years were defined by a single word: Generative AI. Tools like ChatGPT, Gemini, and Claude turned AI from a tech term to a household name. However, we are now entering the next phase of the AI evolution. The conversation is shifting from AI that generates to AI that acts. Gone are the [&#8230;]</p>
<p>The post <a href=""https://www.analyticsvidhya.com/blog/2026/03/generative-ai-vs-agentic-ai/"">Generative AI vs Agentic AI: From Creating Content to Taking Action</a> appeared first on <a href=""https://www.analyticsvidhya.com"">Analytics Vidhya</a>.</p>",2026-03-15 16:45:22,India
ZDNet actualites,https://www.zdnet.fr/feeds/rss/actualites/,"Test Lenovo IdeaCentre Mini x : oubliez les PC portables à 1500 €, les mini-PC sont la solution idéale alors que les prix de la RAM montent en flèche",https://www.zdnet.fr/guide-achat/test-lenovo-ideacentre-mini-x-oubliez-les-pc-portables-a-1500-e-les-mini-pc-sont-la-solution-ideale-alors-que-les-prix-de-la-ram-montent-en-fleche-491808.htm#xtor=RSS-1,"Les points clés à retenir sur le Lenovo IdeaCentre Mini x Le Lenovo IdeaCentre Mini x est disponible au prix de 860€. Il offre des performances fiables grâce à son processeur Snapdragon X Plus, à sa mémoire vive (RAM) généreuse et à un choix correct de ports. Les performances graphiques sont limitées, et la compatibilité [&hellip;]",2026-03-15 11:03:19,France
ZDNet actualites,https://www.zdnet.fr/feeds/rss/actualites/,Test du MacBook Neo : Mon principal doute avec l’ordinateur portable d’entrée de gamme quasi parfait d’Apple,https://www.zdnet.fr/guide-achat/test-du-macbook-neo-mon-principal-doute-avec-lordinateur-portable-dentree-de-gamme-quasi-parfait-dapple-491847.htm#xtor=RSS-1,"Le nouveau MacBook Neo d’Apple à 699 € est un 13 pouces réactif qui ressemble beaucoup à ses prédécesseurs, mais je ne peux m’empêcher de me demander comment il vieillira après quelques années.",2026-03-15 10:03:48,France
Intelligence artificielle : Toute l’actualité sur Le Monde.fr.,https://www.lemonde.fr/intelligence-artificielle/rss_full.xml,"Oscars 2026 : à Hollywood, l’IA vole la vedette aux figurants",https://www.lemonde.fr/m-le-mag/article/2026/03/15/a-hollywood-l-ia-vole-la-vedette-aux-figurants_6671265_4500055.html,"Avant la cérémonie des Oscars, qui se tient dimanche 15 mars à Los Angeles, d’autres statuettes ont distingué les acteurs de second plan. Ils prennent aujourd’hui la parole face à une industrie qui, à la recherche d’économies, semble fascinée par les perspectives offertes par l’intelligence artificielle.",2026-03-15 04:45:03,France
ZDNet actualites,https://www.zdnet.fr/feeds/rss/actualites/,Comment activer la protection avancée sur Android 16 et pourquoi le faire,https://www.zdnet.fr/guide-achat/comment-activer-la-protection-avancee-sur-android-16-et-pourquoi-le-faire-491856.htm#xtor=RSS-1,L'une des fonctionnalités les plus importantes de Google se cache derrière un simple paramètre. Voici où la trouver et comment elle peut vous aider.,2026-03-15 03:03:12,France
ZDNet actualites,https://www.zdnet.fr/feeds/rss/actualites/,Astuces et conseils sur les VPN dont vous ne soupçonniez pas avoir besoin (mais dont vous avez vraiment besoin),https://www.zdnet.fr/pratique/astuces-et-conseils-sur-les-vpn-dont-vous-ne-soupconniez-pas-avoir-besoin-mais-dont-vous-avez-vraiment-besoin-491811.htm#xtor=RSS-1,"Renforcer votre confidentialité et votre sécurité en ligne n'est pas la seule chose que votre VPN peut faire pour vous. Découvrez d'autres paramètres, des options de configuration et bien d'autres astuces pratiques.",2026-03-15 01:03:44,France
ZDNet actualites,https://www.zdnet.fr/feeds/rss/actualites/,"L’administration étudie un poste de travail sous Linux, une circulaire prône l’open source quand «c’est pertinent»",https://www.zdnet.fr/blogs/l-esprit-libre/ladministration-etudie-un-poste-de-travail-sous-linux-une-circulaire-prone-lopen-source-quand-cest-pertinent-491866.htm#xtor=RSS-1,"La Dinum étudie le développement d’un poste de travail sous GNU/Linux. Sébastien Lecornu a publié le 5 février une circulaire qui «recommande de privilégier, lorsque c’est pertinent, le recours à des produits open source».",2026-03-15 01:03:19,France
Intelligence artificielle : Toute l’actualité sur Le Monde.fr.,https://www.lemonde.fr/intelligence-artificielle/rss_full.xml,Pourquoi les plateformes laissent-elles proliférer les contenus générés par IA liés à la guerre ?,https://www.lemonde.fr/pixels/article/2026/03/14/pourquoi-les-plateformes-laissent-elles-proliferer-les-contenus-generes-par-ia-lies-a-la-guerre_6671217_4408996.html,"Depuis le début de l’attaque israélo-américaine sur l’Iran, les réseaux sociaux laissent proliférer les contenus générés par IA sans indications sur leur nature.",2026-03-14 16:00:00,France
Analytics Vidhya,https://www.analyticsvidhya.com/feed/,"Excel 101: IF, AND, OR Functions and Conditional Logic Explained",https://www.analyticsvidhya.com/blog/2026/03/excel-if-and-or-functions-and-conditional-logic-explained/,"<p>You reading this tells me you wish to learn more about Excel. This article continues our Excel series, where we explored the VLOOKUP function in the last iteration. The complete VLOOKUP guide demonstrated how the function works and how best to use it. This time, we shall bring the same focus to conditional logic and [&#8230;]</p>
<p>The post <a href=""https://www.analyticsvidhya.com/blog/2026/03/excel-if-and-or-functions-and-conditional-logic-explained/"">Excel 101: IF, AND, OR Functions and Conditional Logic Explained</a> appeared first on <a href=""https://www.analyticsvidhya.com"">Analytics Vidhya</a>.</p>",2026-03-14 11:28:00,India
ZDNet actualites,https://www.zdnet.fr/feeds/rss/actualites/,J'ai utilisé Gemini Nano Banana 2 pour créer des sketchnotes : voici ce qui a bien fonctionné (et ce qui a tourné au comique),https://www.zdnet.fr/pratique/jai-utilise-gemini-nano-banana-2-pour-creer-des-sketchnotes-voici-ce-qui-a-bien-fonctionne-et-ce-qui-a-tourne-au-comique-491797.htm#xtor=RSS-1,"Les résultats étaient fascinants, impressionnants et parfois étonnamment décevants. Voici cinq leçons que j'ai tirées et qui peuvent vous aider à obtenir de meilleurs résultats plus rapidement.",2026-03-14 11:03:18,France
ZDNet actualites,https://www.zdnet.fr/feeds/rss/actualites/,Mots de passe : La méthode simple pour changer de gestionnaire,https://www.zdnet.fr/pratique/mots-de-passe-la-methode-simple-pour-changer-de-gestionnaire-491816.htm#xtor=RSS-1,J'ai transféré en toute sécurité tous mes identifiants enregistrés vers un nouveau gestionnaire de mots de passe. Vous pouvez faire de même en suivant ces étapes.,2026-03-14 10:03:31,France
Intelligence artificielle : Toute l’actualité sur Le Monde.fr.,https://www.lemonde.fr/intelligence-artificielle/rss_full.xml,« Mes collègues utilisent la version gratuite de ChatGPT sans faire attention aux données déversées » : les entreprises pressées de former à l’IA,https://www.lemonde.fr/campus/article/2026/03/14/mes-collegues-utilisent-la-version-gratuite-de-chatgpt-sans-faire-attention-aux-donnees-deversees-les-entreprises-pressees-de-former-a-l-ia_6671167_4401467.html,"Près de la moitié des Français utilisent déjà l’intelligence artificielle générative. Entre peur de rater le coche et nécessité d’encadrer le « bricolage » des salariés avec ChatGPT, les entreprises s’organisent.",2026-03-14 06:00:32,France
ZDNet actualites,https://www.zdnet.fr/feeds/rss/actualites/,Comment modifier votre service DNS sur un PC Windows ou un Mac – et pourquoi vous devriez le faire,https://www.zdnet.fr/pratique/comment-modifier-votre-service-dns-sur-un-pc-windows-ou-un-mac-et-pourquoi-vous-devriez-le-faire-491805.htm#xtor=RSS-1,Opter pour un fournisseur DNS autre que celui de votre FAI peut vous offrir des performances plus rapides et une meilleure sécurité. Voici comment procéder.,2026-03-14 05:03:54,France
ZDNet actualites,https://www.zdnet.fr/feeds/rss/actualites/,7 façons étonnamment utiles d'utiliser le mode vocal de ChatGPT,https://www.zdnet.fr/pratique/7-facons-etonnamment-utiles-dutiliser-le-mode-vocal-de-chatgpt-491835.htm#xtor=RSS-1,"Le mode vocal donnait des réponses inventées lors de ma dernière utilisation, mais je l'ai testé à nouveau pour voir s'il est réellement utile maintenant.",2026-03-14 03:03:21,France
Intelligence artificielle : Toute l’actualité sur Le Monde.fr.,https://www.lemonde.fr/intelligence-artificielle/rss_full.xml,Meta signe de nouveaux accords avec des médias pour intégrer leurs contenus à son assistant IA,https://www.lemonde.fr/pixels/article/2026/03/14/meta-signe-de-nouveaux-accords-avec-des-medias-pour-integrer-leurs-contenus-a-son-assistant-ia_6671107_4408996.html,"Le géant des réseaux sociaux derrière le modèle de langage Llama s’engage à rémunérer les éditeurs partenaires durant trois ans renouvelables, pour l’utilisation de leurs articles et de leurs archives.",2026-03-13 23:24:57,France
Analytics Vidhya,https://www.analyticsvidhya.com/feed/,How to Switch from ChatGPT to Claude Without Losing Any Context or Memory,https://www.analyticsvidhya.com/blog/2026/03/how-to-switch-from-chatgpt-to-claude/,"<p>I asked ChatGPT how it feels about the recent and AI trend of switching from ChatGPT to Claude. Here is what it said: &#8220;As for how it makes me feel: I don’t have feelings or brand loyalty. But from a usefulness standpoint, it’s a good thing. Easier switching forces AI products to compete on trust, [&#8230;]</p>
<p>The post <a href=""https://www.analyticsvidhya.com/blog/2026/03/how-to-switch-from-chatgpt-to-claude/"">How to Switch from ChatGPT to Claude Without Losing Any Context or Memory</a> appeared first on <a href=""https://www.analyticsvidhya.com"">Analytics Vidhya</a>.</p>",2026-03-13 17:15:08,India
Analytics Vidhya,https://www.analyticsvidhya.com/feed/,A Beginner’s Guide to Building Autonomous AI Agents with MaxClaw,https://www.analyticsvidhya.com/blog/2026/03/maxclaw-cloud-ai-agent-for-autonomous-workflows/,"<p>Most AI tools forget you as soon as you close the browser window. The system begins all interactions with a new user. AI agents provide a solution to this problem because they handle their complete workflow through their system.&#160;MaxClaw&#160;is one of the best in this category.&#160;MiniMax&#160;developed this system which&#160;operates&#160;completely from the cloud space. The system [&#8230;]</p>
<p>The post <a href=""https://www.analyticsvidhya.com/blog/2026/03/maxclaw-cloud-ai-agent-for-autonomous-workflows/"">A Beginner’s Guide to Building Autonomous AI Agents with MaxClaw</a> appeared first on <a href=""https://www.analyticsvidhya.com"">Analytics Vidhya</a>.</p>",2026-03-13 17:11:45,India
Intelligence artificielle : Toute l’actualité sur Le Monde.fr.,https://www.lemonde.fr/intelligence-artificielle/rss_full.xml,Vous avez moins de 30 ans et votre carrière est menacée par l’IA ? Racontez-nous,https://www.lemonde.fr/campus/appel-temoignages/2026/03/13/vous-avez-moins-de-30-ans-et-votre-carriere-est-menacee-par-l-ia-racontez-nous_6671055_4401467.html,"Jeune actif de moins de 30 ans, vous avez des difficultés à trouver un emploi dans une profession exposée à l’arrivée de l’intelligence artificielle ? Etudiant, vous nourrissez des craintes pour votre avenir ? Partagez votre expérience avec nous.",2026-03-13 15:29:53,France
ZDNet actualites,https://www.zdnet.fr/feeds/rss/actualites/,Cybersécurité : Parrot et SEALSQ misent sur le post-quantique pour protéger les drones,https://www.zdnet.fr/actualites/cybersecurite-parrot-et-sealsq-misent-sur-le-post-quantique-pour-proteger-les-drones-491815.htm#xtor=RSS-1,"Face à l'émergence des menaces liées à l'informatique quantique, le constructeur français et le spécialiste des semi-conducteurs annoncent l'intégration de technologies cryptographiques de nouvelle génération dans les futures flottes de drones professionnels.",2026-03-13 07:03:43,France
ZDNet actualites,https://www.zdnet.fr/feeds/rss/actualites/,"Votre smartphone Android bientôt plus fluide grâce à une mise à jour invisible du ""cœur"" du système",https://www.zdnet.fr/actualites/votre-smartphone-android-bientot-plus-fluide-grace-a-une-mise-a-jour-invisible-du-coeur-du-systeme-491819.htm#xtor=RSS-1,"Face à une consommation CPU où le noyau représente 40 % de l'activité, Google déploie AutoFDO pour le kernel Android. Explications.",2026-03-13 07:03:07,France
ZDNet actualites,https://www.zdnet.fr/feeds/rss/actualites/,"Apple MacBook Neo vs Apple Mac Mini : ces deux ordinateurs sont vendus au même prix, mais lequel vous convient le mieux ?",https://www.zdnet.fr/guide-achat/apple-macbook-neo-vs-apple-mac-mini-ces-deux-ordinateurs-sont-vendus-au-meme-prix-mais-lequel-vous-convient-le-mieux-491765.htm#xtor=RSS-1,Le tout nouveau portable d’entrée de gamme et la machine la plus petite de la marque à la pomme coûtent pareil mais s'adressent à des utilisateurs très différents. Voici des critères pour vous aider à faire votre choix.,2026-03-13 06:03:45,France
Analytics Vidhya,https://www.analyticsvidhya.com/feed/,"AI vs Generative AI: Key Differences, Models, and Real-World Uses",https://www.analyticsvidhya.com/blog/2026/03/ai-vs-generative-ai/,"<p>Tools like ChatGPT, Gemini, and Claude pushed AI into everyday conversations. Suddenly everyone was talking about AI and a newer term that appeared alongside it: Generative AI. The two are often used interchangeably, but they aren’t the same thing. Generative AI isn’t a replacement for AI. It’s a part of it. To understand the difference, [&#8230;]</p>
<p>The post <a href=""https://www.analyticsvidhya.com/blog/2026/03/ai-vs-generative-ai/"">AI vs Generative AI: Key Differences, Models, and Real-World Uses</a> appeared first on <a href=""https://www.analyticsvidhya.com"">Analytics Vidhya</a>.</p>",2026-03-12 15:51:12,India
Analytics Vidhya,https://www.analyticsvidhya.com/feed/,"Anthropic Says AI is Not “Killing Jobs”, Shares New Way to Measure AI Job Impact",https://www.analyticsvidhya.com/blog/2026/03/anthropic-ai-job-impact/,"<p>This is not another of those &#8216;AI is killing jobs&#8217; reports. Anthropic, in a new research, seems to have asked the deeper questions this time. Its latest labour-market study asks what happens when we stop guessing which jobs AI could affect. What if we, instead, start measuring where it is actually showing up inside real [&#8230;]</p>
<p>The post <a href=""https://www.analyticsvidhya.com/blog/2026/03/anthropic-ai-job-impact/"">Anthropic Says AI is Not &#8220;Killing Jobs&#8221;, Shares New Way to Measure AI Job Impact</a> appeared first on <a href=""https://www.analyticsvidhya.com"">Analytics Vidhya</a>.</p>",2026-03-12 13:33:00,India
Intelligence artificielle : Toute l’actualité sur Le Monde.fr.,https://www.lemonde.fr/intelligence-artificielle/rss_full.xml,"Laure de Roucy-Rochegonde, politiste : « Le recours à l’IA dans le cadre des opérations militaires marginalise la prise de décision humaine »",https://www.lemonde.fr/idees/article/2026/03/11/laure-de-roucy-rochegonde-politiste-le-recours-a-l-ia-dans-le-cadre-des-operations-militaires-marginalise-la-prise-de-decision-humaine_6670414_3232.html,"Dans une tribune au « Monde », la directrice du centre géopolitique des technologies de l’IFRI estime que l’ampleur et la succession des actions menées par l’intelligence artificielle sur les terrains de guerre rendent les opérations trop rapides pour être appréhendées par un esprit humain.",2026-03-11 04:00:12,France
Intelligence artificielle : Toute l’actualité sur Le Monde.fr.,https://www.lemonde.fr/intelligence-artificielle/rss_full.xml,"Au Canada, la famille d’une victime de la tuerie de Tumbler Ridge poursuit OpenAI pour négligence",https://www.lemonde.fr/international/article/2026/03/11/au-canada-la-famille-d-une-victime-de-la-tuerie-de-tumbler-ridge-poursuit-openai-pour-negligence_6670341_3210.html,"Le compte ChatGPT de Jesse Van Rotselaar, qui a tué huit personnes le 10 février, avait été suspendu plusieurs mois avant le drame en raison de messages inquiétants, mais l’entreprise d’IA n’avait pas alerté les autorités.",2026-03-11 00:49:22,France
Intelligence artificielle : Toute l’actualité sur Le Monde.fr.,https://www.lemonde.fr/intelligence-artificielle/rss_full.xml,Yann Le Cun lève 900 millions d’euros pour sa start-up d’IA basée en France,https://www.lemonde.fr/economie/article/2026/03/10/intelligence-artificielle-yann-le-cun-leve-900-millions-d-euros-pour-sa-start-up-basee-en-france_6670181_3234.html,"Valorisée 3 milliards d’euros, AMI, la nouvelle entreprise de l’ex-directeur de l’intelligence artificielle chez Meta, ambitionne de créer une « nouvelle branche » de l’IA relative au monde réel.",2026-03-10 05:00:06,France
Intelligence artificielle : Toute l’actualité sur Le Monde.fr.,https://www.lemonde.fr/intelligence-artificielle/rss_full.xml,Anthropic attaque le gouvernement fédéral des Etats-Unis en justice pour des sanctions jugées excessives,https://www.lemonde.fr/international/article/2026/03/09/la-start-up-d-intelligence-artificielle-anthropic-attaque-le-gouvernement-americain-en-justice-pour-sanctions-excessives_6670131_3210.html,"La start-up californienne avait refusé d’ouvrir sans restriction à l’armée américaine son modèle d’IA, évoquant un principe éthique. En représailles, le ministère de la défense l’avait ajoutée à sa liste de sociétés présentant un « risque pour les approvisionnements ».",2026-03-09 16:54:05,France
Intelligence artificielle : Toute l’actualité sur Le Monde.fr.,https://www.lemonde.fr/intelligence-artificielle/rss_full.xml,« La guerre est une affaire trop sensible pour être pilotée par l’IA »,https://www.lemonde.fr/idees/article/2026/03/09/la-guerre-est-une-affaire-trop-sensible-pour-etre-pilotee-par-l-ia_6670086_3232.html,"L’épreuve de force qui a éclaté fin février aux Etats-Unis entre le secrétaire à la défense, Pete Hegseth, et Dario Amodei, le patron d’Anthropic, révèle l’urgence d’établir un cadre politique et juridique capable d’arbitrer l’usage de la technologie, estime Stéphane Lauer, éditorialiste au « Monde », dans sa chronique.",2026-03-09 11:17:05,France
Intelligence artificielle : Toute l’actualité sur Le Monde.fr.,https://www.lemonde.fr/intelligence-artificielle/rss_full.xml,La Chine repasse devant les Etats-Unis en nombre de milliardaires grâce à la tech et à l’IA,https://www.lemonde.fr/economie/article/2026/03/09/la-chine-repasse-devant-les-etats-unis-en-nombre-de-milliardaires-grace-a-la-tech-et-a-l-ia_6670031_3234.html,"Le cabinet Hurun a dévoilé, jeudi, son classement des milliardaires : la Chine en compte 287 de plus qu’en 2025. Les fondateurs de la tech dominent le palmarès.",2026-03-09 04:00:09,France
Intelligence artificielle : Toute l’actualité sur Le Monde.fr.,https://www.lemonde.fr/intelligence-artificielle/rss_full.xml,Cinq astuces pour utiliser l’IA sans délaisser ses neurones,https://www.lemonde.fr/pixels/article/2026/03/07/cinq-astuces-pour-utiliser-l-ia-sans-delaisser-ses-neurones_6669858_4408996.html,Limiter l’usage de l’intelligence artificielle à certains contextes et interroger les réponses qu’elle fournit permet de ne pas abandonner certaines de ses aptitudes cognitives en chemin.,2026-03-07 05:00:19,France
Intelligence artificielle : Toute l’actualité sur Le Monde.fr.,https://www.lemonde.fr/intelligence-artificielle/rss_full.xml,"« On voit aussi des scènes de sexe filmées » : quand les sous-traitants des lunettes Meta à Nairobi voient tout, vraiment tout",https://www.lemonde.fr/economie/article/2026/03/06/ia-quand-les-sous-traitants-des-lunettes-meta-a-nairobi-voient-tout-vraiment-tout_6669773_3234.html,"Deux médias suédois ont révélé que des employés d’un sous-traitant de Meta au Kenya visionnent les images captées par les lunettes connectées « Ray-Ban Meta », y compris des scènes intimes. Une plainte a été déposée aux Etats-Unis.",2026-03-06 13:00:09,France
Intelligence artificielle : Toute l’actualité sur Le Monde.fr.,https://www.lemonde.fr/intelligence-artificielle/rss_full.xml,"Dario Amodei, l’ambivalent patron d’Anthropic qui se dresse contre Donald Trump",https://www.lemonde.fr/economie/article/2026/03/05/dario-amodei-l-ambivalent-patron-d-anthropic-qui-se-dresse-contre-donald-trump_6669661_3234.html,"Derrière ses positions en faveur d’une intelligence artificielle éthique, le patron de la tech, qui a refusé de donner au Pentagone un accès sans contrainte à son IA, est aussi un entrepreneur pragmatique. Ses concurrents lui reprochent d’adopter une posture catastrophiste pour mieux ériger sa start-up comme la seule capable de développer cette technologie sans trop de dommages.",2026-03-05 16:45:03,France
Intelligence artificielle : Toute l’actualité sur Le Monde.fr.,https://www.lemonde.fr/intelligence-artificielle/rss_full.xml,« Les usagers ne nous comprennent pas toujours » : les impôts font appel à l’IA pour être « moins verbeux »,https://www.lemonde.fr/politique/article/2026/03/04/les-usagers-ne-nous-comprennent-pas-toujours-les-impots-font-appel-a-l-ia-pour-etre-moins-verbeux_6669552_823448.html,La direction générale des finances publiques met en place en interne une solution d’intelligence artificielle permettant à ses agents de reformuler leurs réponses aux usagers.,2026-03-04 18:00:03,France
Intelligence artificielle : Toute l’actualité sur Le Monde.fr.,https://www.lemonde.fr/intelligence-artificielle/rss_full.xml,"« Plutôt que de diaboliser ou adorer l’IA, il faut en analyser précisément les conséquences sociales »",https://www.lemonde.fr/idees/article/2026/03/04/plutot-que-de-diaboliser-ou-adorer-l-ia-il-faut-en-analyser-precisement-les-consequences-sociales_6669522_3232.html,L’économiste Pierre-Cyrille Hautcœur rend compte d’une recherche instructive ayant utilisé l’intelligence artificielle pour mesurer les conséquences massives de l’industrialisation de la chaussure en Angleterre au XIXᵉ siècle.,2026-03-04 14:00:06,France
Intelligence artificielle : Toute l’actualité sur Le Monde.fr.,https://www.lemonde.fr/intelligence-artificielle/rss_full.xml,"Au Japon, un parti politique misant tout sur l’IA fait sensation",https://www.lemonde.fr/international/article/2026/03/04/au-japon-un-parti-politique-misant-tout-sur-l-ia-fait-sensation_6669433_3210.html,"Team Mirai, fondé en 2025, a créé la surprise aux dernières législatives avec 11 élus. Composée d’ingénieurs et de programmeurs, la formation prône la généralisation de l’intelligence artificielle pour résoudre les problèmes du pays.",2026-03-04 02:00:12,France
The Tech Buzz - Latest Articles,https://www.techbuzz.ai/api/rss/articles,Chinese AI Stocks Surge After Nvidia's Huang Calls OpenClaw 'Next ChatGPT',https://www.techbuzz.ai/articles/chinese-ai-stocks-surge-after-nvidia-s-huang-calls-openclaw-next-chatgpt,"Zhipu, MiniMax shares jump as Nvidia CEO endorses Chinese AI agent platform",2026-03-18 08:08:44,USA
Analytics Vidhya,https://www.analyticsvidhya.com/feed/,A Guide to OpenRouter for AI Development,https://www.analyticsvidhya.com/blog/2026/03/a-guide-to-openrouter/,"<p>Building with AI today can feel messy. You might use one API for text, another for images, and a different one for something else. Every model comes with its own setup, API key, and billing. This slows you down and makes things harder than they need to be. What if you could use all these [&#8230;]</p>
<p>The post <a href=""https://www.analyticsvidhya.com/blog/2026/03/a-guide-to-openrouter/"">A Guide to OpenRouter for AI Development</a> appeared first on <a href=""https://www.analyticsvidhya.com"">Analytics Vidhya</a>.</p>",2026-03-18 08:48:59,India
ZDNet actualites,https://www.zdnet.fr/feeds/rss/actualites/,IA : NVIDIA et Oracle franchissent un cap décisif dans la vitesse de traitement des données,https://www.zdnet.fr/actualites/ia-nvidia-et-oracle-franchissent-un-cap-decisif-dans-la-vitesse-de-traitement-des-donnees-492146.htm#xtor=RSS-1,"NVIDIA et Oracle ont présenté une avancée majeure dans le traitement des données dédiées à l'IA. Grâce à une technologie d’indexation vectorielle accélérée par GPU, les deux partenaires entendent lever les freins liés à l’exploitation massive de données non structurées et multimodales.",2026-03-19 09:03:29,France
ZDNet actualites,https://www.zdnet.fr/feeds/rss/actualites/,"Le MacBook Neo bouleverse le marché des ordinateurs portables d'entrée de gamme, et c'est une mauvaise nouvelle pour les fabricants de PC",https://www.zdnet.fr/actualites/le-macbook-neo-bouleverse-le-marche-des-ordinateurs-portables-dentree-de-gamme-et-cest-une-mauvaise-nouvelle-pour-les-fabricants-de-pc-492141.htm#xtor=RSS-1,"Apple a longtemps refusé de concurrencer les fabricants d'ordinateurs portables bon marché, jusqu'à aujourd’hui. Voici qui gagne et qui perd à la suite de l'arrivée du MacBook Neo.",2026-03-19 08:03:11,France
